Observation-CTDensitometryRightEyeExample.json

{
  "resourceType" : "Observation",
  "id" : "CTDensitometryRightEyeExample",
  "meta" : {
    "profile" : ["https://YasniiSS.github.io/fhir4eyes/StructureDefinition/ct-densitometry"]
  },
  "text" : {
    "status" : "generated",
    "div" : "<div xmlns=\"http://www.w3.org/1999/xhtml\"><p class=\"res-header-id\"><b>Generated Narrative: Observation CTDensitometryRightEyeExample</b></p><a name=\"CTDensitometryRightEyeExample\"> </a><a name=\"hcCTDensitometryRightEyeExample\"> </a><div style=\"display: inline-block; background-color: #d9e0e7; padding: 6px; margin: 4px; border: 1px solid #8da1b4; border-radius: 5px; line-height: 60%\"><p style=\"margin-bottom: 0px\"/><p style=\"margin-bottom: 0px\">Profile: <a href=\"StructureDefinition-ct-densitometry.html\">Corneal Tomography - Densitometry</a></p></div><p><b>status</b>: Final</p><p><b>category</b>: <span title=\"Codes:{http://terminology.hl7.org/CodeSystem/observation-category exam}\">Exam</span></p><p><b>code</b>: <span title=\"Codes:{https://YasniiSS.github.io/fhir4eyes/CodeSystem/fhir4eyes-cs corneal-densitometry}\">Corneal tomography, densitometry analysis</span></p><p><b>subject</b>: <a href=\"Patient-PatientExample.html\">Patient Example  Female, DoB: 1990-01-01 ( Passport number: PA1234567)</a></p><p><b>effective</b>: 2026-08-18 09:00:00+0000</p><p><b>performer</b>: <a href=\"Practitioner-OphthalmologistExample.html\">Practitioner Ophthalmologist Example </a></p><p><b>bodySite</b>: <span title=\"Codes:\"></span></p><p><b>device</b>: Pentacam AXL</p><blockquote><p><b>component</b></p><p><b>code</b>: <span title=\"Codes:{https://YasniiSS.github.io/fhir4eyes/CodeSystem/fhir4eyes-cs corneal-densitometry-zone-0-2mm}\">Densitometry 0-2mm zone</span></p><p><b>value</b>: 16.8 {GSU}<span style=\"background: LightGoldenRodYellow\"> (Details: UCUM  code{GSU} = '{GSU}')</span></p></blockquote><blockquote><p><b>component</b></p><p><b>code</b>: <span title=\"Codes:{https://YasniiSS.github.io/fhir4eyes/CodeSystem/fhir4eyes-cs corneal-densitometry-zone-2-6mm}\">Densitometry 2-6mm zone</span></p><p><b>value</b>: 14.2 {GSU}<span style=\"background: LightGoldenRodYellow\"> (Details: UCUM  code{GSU} = '{GSU}')</span></p></blockquote><blockquote><p><b>component</b></p><p><b>code</b>: <span title=\"Codes:{https://YasniiSS.github.io/fhir4eyes/CodeSystem/fhir4eyes-cs corneal-densitometry-zone-6-10mm}\">Densitometry 6-10mm zone</span></p><p><b>value</b>: 17.5 {GSU}<span style=\"background: LightGoldenRodYellow\"> (Details: UCUM  code{GSU} = '{GSU}')</span></p></blockquote><blockquote><p><b>component</b></p><p><b>code</b>: <span title=\"Codes:{https://YasniiSS.github.io/fhir4eyes/CodeSystem/fhir4eyes-cs corneal-densitometry-total}\">Densitometry total</span></p><p><b>value</b>: 15.9 {GSU}<span style=\"background: LightGoldenRodYellow\"> (Details: UCUM  code{GSU} = '{GSU}')</span></p></blockquote><blockquote><p><b>component</b></p><p><b>code</b>: <span title=\"Codes:{https://YasniiSS.github.io/fhir4eyes/CodeSystem/fhir4eyes-cs corneal-densitometry-anterior-layer}\">Densitometry anterior layer</span></p><p><b>value</b>: 19.1 {GSU}<span style=\"background: LightGoldenRodYellow\"> (Details: UCUM  code{GSU} = '{GSU}')</span></p></blockquote><blockquote><p><b>component</b></p><p><b>code</b>: <span title=\"Codes:{https://YasniiSS.github.io/fhir4eyes/CodeSystem/fhir4eyes-cs corneal-densitometry-central-layer}\">Densitometry central layer</span></p><p><b>value</b>: 13.4 {GSU}<span style=\"background: LightGoldenRodYellow\"> (Details: UCUM  code{GSU} = '{GSU}')</span></p></blockquote><blockquote><p><b>component</b></p><p><b>code</b>: <span title=\"Codes:{https://YasniiSS.github.io/fhir4eyes/CodeSystem/fhir4eyes-cs corneal-densitometry-posterior-layer}\">Densitometry posterior layer</span></p><p><b>value</b>: 15 {GSU}<span style=\"background: LightGoldenRodYellow\"> (Details: UCUM  code{GSU} = '{GSU}')</span></p></blockquote></div>"
  },
  "status" : "final",
  "category" : [{
    "coding" : [{
      "system" : "http://terminology.hl7.org/CodeSystem/observation-category",
      "code" : "exam",
      "display" : "Exam"
    }]
  }],
  "code" : {
    "coding" : [{
      "system" : "https://YasniiSS.github.io/fhir4eyes/CodeSystem/fhir4eyes-cs",
      "code" : "corneal-densitometry",
      "display" : "Corneal densitometry"
    }],
    "text" : "Corneal tomography, densitometry analysis"
  },
  "subject" : {
    "reference" : "Patient/PatientExample"
  },
  "effectiveDateTime" : "2026-08-18T09:00:00Z",
  "performer" : [{
    "reference" : "Practitioner/OphthalmologistExample"
  }],
  "bodySite" : {
    "extension" : [{
      "url" : "http://hl7.org/fhir/StructureDefinition/bodySite",
      "valueReference" : {
        "reference" : "BodyStructure/RightEyeStructureExample"
      }
    }]
  },
  "device" : {
    "display" : "Pentacam AXL"
  },
  "component" : [{
    "code" : {
      "coding" : [{
        "system" : "https://YasniiSS.github.io/fhir4eyes/CodeSystem/fhir4eyes-cs",
        "code" : "corneal-densitometry-zone-0-2mm",
        "display" : "Corneal densitometry, 0-2 mm zone"
      }],
      "text" : "Densitometry 0-2mm zone"
    },
    "valueQuantity" : {
      "value" : 16.8,
      "system" : "http://unitsofmeasure.org",
      "code" : "{GSU}"
    }
  },
  {
    "code" : {
      "coding" : [{
        "system" : "https://YasniiSS.github.io/fhir4eyes/CodeSystem/fhir4eyes-cs",
        "code" : "corneal-densitometry-zone-2-6mm",
        "display" : "Corneal densitometry, 2-6 mm zone"
      }],
      "text" : "Densitometry 2-6mm zone"
    },
    "valueQuantity" : {
      "value" : 14.2,
      "system" : "http://unitsofmeasure.org",
      "code" : "{GSU}"
    }
  },
  {
    "code" : {
      "coding" : [{
        "system" : "https://YasniiSS.github.io/fhir4eyes/CodeSystem/fhir4eyes-cs",
        "code" : "corneal-densitometry-zone-6-10mm",
        "display" : "Corneal densitometry, 6-10 mm zone"
      }],
      "text" : "Densitometry 6-10mm zone"
    },
    "valueQuantity" : {
      "value" : 17.5,
      "system" : "http://unitsofmeasure.org",
      "code" : "{GSU}"
    }
  },
  {
    "code" : {
      "coding" : [{
        "system" : "https://YasniiSS.github.io/fhir4eyes/CodeSystem/fhir4eyes-cs",
        "code" : "corneal-densitometry-total",
        "display" : "Corneal densitometry, total"
      }],
      "text" : "Densitometry total"
    },
    "valueQuantity" : {
      "value" : 15.9,
      "system" : "http://unitsofmeasure.org",
      "code" : "{GSU}"
    }
  },
  {
    "code" : {
      "coding" : [{
        "system" : "https://YasniiSS.github.io/fhir4eyes/CodeSystem/fhir4eyes-cs",
        "code" : "corneal-densitometry-anterior-layer",
        "display" : "Corneal densitometry, anterior layer"
      }],
      "text" : "Densitometry anterior layer"
    },
    "valueQuantity" : {
      "value" : 19.1,
      "system" : "http://unitsofmeasure.org",
      "code" : "{GSU}"
    }
  },
  {
    "code" : {
      "coding" : [{
        "system" : "https://YasniiSS.github.io/fhir4eyes/CodeSystem/fhir4eyes-cs",
        "code" : "corneal-densitometry-central-layer",
        "display" : "Corneal densitometry, central layer"
      }],
      "text" : "Densitometry central layer"
    },
    "valueQuantity" : {
      "value" : 13.4,
      "system" : "http://unitsofmeasure.org",
      "code" : "{GSU}"
    }
  },
  {
    "code" : {
      "coding" : [{
        "system" : "https://YasniiSS.github.io/fhir4eyes/CodeSystem/fhir4eyes-cs",
        "code" : "corneal-densitometry-posterior-layer",
        "display" : "Corneal densitometry, posterior layer"
      }],
      "text" : "Densitometry posterior layer"
    },
    "valueQuantity" : {
      "value" : 15,
      "system" : "http://unitsofmeasure.org",
      "code" : "{GSU}"
    }
  }]
}

Observation-CTDensitometryRightEyeExample.md

## Example Observation: CT densitometry: right eye

> **component****code**: Densitometry 0-2mm zone**value**: 16.8 {GSU} (Details: UCUM code{GSU} = '{GSU}')

> **component****code**: Densitometry 2-6mm zone**value**: 14.2 {GSU} (Details: UCUM code{GSU} = '{GSU}')

> **component****code**: Densitometry 6-10mm zone**value**: 17.5 {GSU} (Details: UCUM code{GSU} = '{GSU}')

> **component****code**: Densitometry total**value**: 15.9 {GSU} (Details: UCUM code{GSU} = '{GSU}')

> **component****code**: Densitometry anterior layer**value**: 19.1 {GSU} (Details: UCUM code{GSU} = '{GSU}')

> **component****code**: Densitometry central layer**value**: 13.4 {GSU} (Details: UCUM code{GSU} = '{GSU}')